{
  "id": "sg-singapore-stamford-american-international-school",
  "name": "Stamford American International School",
  "former_names": [],
  "status": "active",
  "location": {
    "country": "Singapore",
    "city": "Singapore",
    "district": null,
    "address": null,
    "lat": null,
    "lng": null
  },
  "founded": null,
  "school_type": null,
  "curricula": [
    "Advanced Placement (AP)",
    "International Baccalaureate Diploma Programme (IBDP)",
    "Business and Technical Education Council (BTEC) Diploma"
  ],
  "age_range": {
    "min": null,
    "max": 18
  },
  "year_groups": [],
  "accreditations": [],
  "fees": {
    "published": false,
    "currency": null,
    "academic_year": null,
    "fee_basis": null,
    "by_year_group": [],
    "additional": {
      "application": null,
      "enrolment": null,
      "capital_levy": null,
      "bus": null,
      "lunch": null,
      "uniform": null
    },
    "sibling_discount": null,
    "early_payment_discount": null
  },
  "enrolment": {
    "total": null,
    "nationalities_count": null,
    "largest_nationality": null,
    "largest_nationality_pct": null
  },
  "staffing": {
    "teacher_student_ratio": null,
    "avg_class_size": null,
    "expat_teacher_pct": null
  },
  "languages": {
    "instruction": [],
    "offered": [],
    "eal_provision": {
      "offered": null,
      "model": null,
      "additional_cost": null
    }
  },
  "outcomes": {
    "ib_average": null,
    "ib_year": null,
    "igcse_a_star_a_pct": null,
    "university_destinations": []
  },
  "admissions": {
    "open_days": [],
    "application_deadline": null,
    "assessment_required": null,
    "waitlist": null
  },
  "facilities": [],
  "contact": {
    "website": null,
    "admissions_url": null,
    "phone": null,
    "email": null
  },
  "provenance": {
    "name": {
      "source_url": "https://www.sais.edu.sg/about-us/welcome/",
      "retrieved_date": "2026-09-18",
      "evidence": "About Stamford American International School Singapore",
      "method": "published",
      "conflict": false,
      "candidates": []
    },
    "location.country": {
      "source_url": "https://www.sais.edu.sg/about-us/welcome/",
      "retrieved_date": "2026-09-18",
      "evidence": "About Stamford American International School Singapore",
      "method": "published",
      "conflict": false,
      "candidates": []
    },
    "location.city": {
      "source_url": "https://www.sais.edu.sg/about-us/welcome/",
      "retrieved_date": "2026-09-18",
      "evidence": "About Stamford American International School Singapore",
      "method": "published",
      "conflict": false,
      "candidates": []
    },
    "age_range.max": {
      "source_url": "https://www.sais.edu.sg/about-us/welcome/",
      "retrieved_date": "2026-09-18",
      "evidence": "children aged 18 months to 18 years",
      "method": "published",
      "conflict": false,
      "candidates": []
    },
    "curricula[0]": {
      "source_url": "https://www.sais.edu.sg/about-us/welcome/",
      "retrieved_date": "2026-09-18",
      "evidence": "offer Advanced Placement (AP), International Baccalaureate Diploma Programme",
      "method": "published",
      "conflict": false,
      "candidates": []
    },
    "curricula[1]": {
      "source_url": "https://www.sais.edu.sg/about-us/welcome/",
      "retrieved_date": "2026-09-18",
      "evidence": "International Baccalaureate Diploma Programme (IBDP) and Business and Technical Education Council",
      "method": "published",
      "conflict": false,
      "candidates": []
    },
    "curricula[2]": {
      "source_url": "https://www.sais.edu.sg/about-us/welcome/",
      "retrieved_date": "2026-09-18",
      "evidence": "Business and Technical Education Council (BTEC) Diploma curricula",
      "method": "published",
      "conflict": false,
      "candidates": []
    }
  },
  "completeness_score": 3,
  "indexable": false,
  "last_verified": "2026-09-18"
}
