{
  "id": "th-chiang-mai-nakornpayap-international-school",
  "name": "Nakornpayap International School",
  "former_names": [],
  "status": "unverified",
  "location": {
    "country": "Thailand",
    "city": "Chiang Mai",
    "district": null,
    "address": "240 Moo 6, San Phi Sua, Muang, Chiang Mai, Thailand 50300",
    "lat": null,
    "lng": null
  },
  "founded": 1993,
  "school_type": null,
  "curricula": [
    "American Common Core–based curriculum",
    "Advanced Placement (AP)"
  ],
  "age_range": {
    "min": null,
    "max": null
  },
  "year_groups": [],
  "accreditations": [
    {
      "body": "Western Association of Schools and Colleges (WASC)",
      "status": null,
      "granted": null,
      "expires": null
    }
  ],
  "fees": {
    "published": true,
    "currency": "THB",
    "academic_year": "2025/2026",
    "fee_basis": null,
    "by_year_group": [
      {
        "label": "K1-K3",
        "tuition": "290,000"
      },
      {
        "label": "Grade 1-3",
        "tuition": "385,000"
      },
      {
        "label": "Grade 4-5",
        "tuition": "402,500"
      },
      {
        "label": "Grade 6-8",
        "tuition": "435,600"
      },
      {
        "label": "Grade 9-12",
        "tuition": "496,800"
      }
    ],
    "additional": {
      "application": null,
      "enrolment": null,
      "capital_levy": null,
      "bus": null,
      "lunch": null,
      "uniform": null
    },
    "sibling_discount": "10,000 THB/semester for second child onwards",
    "early_payment_discount": null
  },
  "enrolment": {
    "nationalities_count": null,
    "largest_nationality": null,
    "largest_nationality_pct": null
  },
  "staffing": {
    "avg_class_size": null,
    "expat_teacher_pct": null
  },
  "languages": {
    "instruction": [],
    "offered": [],
    "eal_provision": {
      "offered": null,
      "model": null,
      "additional_cost": null
    }
  },
  "outcomes": {
    "ib_average": null,
    "ib_year": null,
    "igcse_a_star_a_pct": null,
    "university_destinations": []
  },
  "admissions": {
    "application_deadline": null,
    "assessment_required": null,
    "waitlist": null
  },
  "facilities": [],
  "contact": {
    "website": "https://www.nis.ac.th/",
    "admissions_url": null,
    "phone": "+(66) 53 110 680",
    "email": "info@nis.ac.th"
  },
  "provenance": {
    "name": {
      "source_url": "https://www.nis.ac.th/",
      "retrieved_date": "2026-09-24",
      "evidence": "Welcome to Nakornpayap International School (NIS).",
      "method": "published",
      "conflict": false,
      "candidates": []
    },
    "location.country": {
      "source_url": "https://www.nis.ac.th/",
      "retrieved_date": "2026-09-24",
      "evidence": "240 Moo 6, San Phi Sua, Muang, Chiang Mai, Thailand 50300",
      "method": "published",
      "conflict": false,
      "candidates": []
    },
    "location.city": {
      "source_url": "https://www.nis.ac.th/",
      "retrieved_date": "2026-09-24",
      "evidence": "240 Moo 6, San Phi Sua, Muang, Chiang Mai, Thailand 50300",
      "method": "published",
      "conflict": false,
      "candidates": []
    },
    "location.address": {
      "source_url": "https://www.nis.ac.th/",
      "retrieved_date": "2026-09-24",
      "evidence": "240 Moo 6, San Phi Sua, Muang, Chiang Mai, Thailand 50300",
      "method": "published",
      "conflict": false,
      "candidates": []
    },
    "founded": {
      "source_url": "https://www.nis.ac.th/",
      "retrieved_date": "2026-09-24",
      "evidence": "Founded in 1993",
      "method": "published",
      "conflict": false,
      "candidates": []
    },
    "curricula[0]": {
      "source_url": "https://www.nis.ac.th/",
      "retrieved_date": "2026-09-24",
      "evidence": "Our American Common Core–based curriculum, complemented by Advanced Placement (AP) courses",
      "method": "published",
      "conflict": false,
      "candidates": []
    },
    "curricula[1]": {
      "source_url": "https://www.nis.ac.th/",
      "retrieved_date": "2026-09-24",
      "evidence": "complemented by Advanced Placement (AP) courses",
      "method": "published",
      "conflict": false,
      "candidates": []
    },
    "accreditations[0].body": {
      "source_url": "https://www.nis.ac.th/",
      "retrieved_date": "2026-09-24",
      "evidence": "fully accredited by the Western Association of Schools and Colleges (WASC)",
      "method": "published",
      "conflict": false,
      "candidates": []
    },
    "fees.currency": {
      "source_url": "https://www.nis.ac.th/admissions/tuition-fees",
      "retrieved_date": "2026-09-24",
      "evidence": "Per Semester (THB) Per Year (THB)",
      "method": "published",
      "conflict": false,
      "candidates": []
    },
    "fees.academic_year": {
      "source_url": "https://www.nis.ac.th/admissions/tuition-fees",
      "retrieved_date": "2026-09-24",
      "evidence": "Tuition fees 2025/2026",
      "method": "published",
      "conflict": false,
      "candidates": []
    },
    "fees.by_year_group[0].label": {
      "source_url": "https://www.nis.ac.th/admissions/tuition-fees",
      "retrieved_date": "2026-09-24",
      "evidence": "K1-K3 145,000 290,000",
      "method": "published",
      "conflict": false,
      "candidates": []
    },
    "fees.by_year_group[0].tuition": {
      "source_url": "https://www.nis.ac.th/admissions/tuition-fees",
      "retrieved_date": "2026-09-24",
      "evidence": "K1-K3 145,000 290,000",
      "method": "published",
      "conflict": false,
      "candidates": []
    },
    "fees.by_year_group[1].label": {
      "source_url": "https://www.nis.ac.th/admissions/tuition-fees",
      "retrieved_date": "2026-09-24",
      "evidence": "Grade 1-3 192,500 385,000",
      "method": "published",
      "conflict": false,
      "candidates": []
    },
    "fees.by_year_group[1].tuition": {
      "source_url": "https://www.nis.ac.th/admissions/tuition-fees",
      "retrieved_date": "2026-09-24",
      "evidence": "Grade 1-3 192,500 385,000",
      "method": "published",
      "conflict": false,
      "candidates": []
    },
    "fees.by_year_group[2].label": {
      "source_url": "https://www.nis.ac.th/admissions/tuition-fees",
      "retrieved_date": "2026-09-24",
      "evidence": "Grade 4-5 201,250 402,500",
      "method": "published",
      "conflict": false,
      "candidates": []
    },
    "fees.by_year_group[2].tuition": {
      "source_url": "https://www.nis.ac.th/admissions/tuition-fees",
      "retrieved_date": "2026-09-24",
      "evidence": "Grade 4-5 201,250 402,500",
      "method": "published",
      "conflict": false,
      "candidates": []
    },
    "fees.by_year_group[3].label": {
      "source_url": "https://www.nis.ac.th/admissions/tuition-fees",
      "retrieved_date": "2026-09-24",
      "evidence": "Grade 6-8 217,800 435,600",
      "method": "published",
      "conflict": false,
      "candidates": []
    },
    "fees.by_year_group[3].tuition": {
      "source_url": "https://www.nis.ac.th/admissions/tuition-fees",
      "retrieved_date": "2026-09-24",
      "evidence": "Grade 6-8 217,800 435,600",
      "method": "published",
      "conflict": false,
      "candidates": []
    },
    "fees.by_year_group[4].label": {
      "source_url": "https://www.nis.ac.th/admissions/tuition-fees",
      "retrieved_date": "2026-09-24",
      "evidence": "Grade 9-12 248,400 496,800",
      "method": "published",
      "conflict": false,
      "candidates": []
    },
    "fees.by_year_group[4].tuition": {
      "source_url": "https://www.nis.ac.th/admissions/tuition-fees",
      "retrieved_date": "2026-09-24",
      "evidence": "Grade 9-12 248,400 496,800",
      "method": "published",
      "conflict": false,
      "candidates": []
    },
    "fees.sibling_discount": {
      "source_url": "https://www.nis.ac.th/admissions/tuition-fees",
      "retrieved_date": "2026-09-24",
      "evidence": "Sibling Discount: 10,000 THB/semester for second child onwards",
      "method": "published",
      "conflict": false,
      "candidates": []
    },
    "contact.phone": {
      "source_url": "https://www.nis.ac.th/",
      "retrieved_date": "2026-09-24",
      "evidence": "Phone +(66) 53 110 680",
      "method": "published",
      "conflict": false,
      "candidates": []
    },
    "contact.email": {
      "source_url": "https://www.nis.ac.th/",
      "retrieved_date": "2026-09-24",
      "evidence": "Email info@nis.ac.th",
      "method": "published",
      "conflict": false,
      "candidates": []
    }
  },
  "completeness_score": 7,
  "indexable": false,
  "last_verified": "2026-09-24"
}
